q_id,topic,mean,std,description
Q568742,3D modeling,-0.17388824,0.263116,process of developing a mathematical representation of any three-dimensional surface of object via specialized software
Q56933,image segmentation,0.01745817,0.19769314,Division of an image into sets of pixels for further processing
Q57261400,continuous deployment,0.29663488,0.30420983,software engineering approach in which software functionalities are delivered frequently
Q58199,instant messaging,0.1331054,0.25639167,form of communication over the Internet
Q58748,object–relational mapping,-0.533762,0.27622992,programming technique
Q5915793,geographic information,-0.2526192,0.19241379,data and information having an implicit or explicit association with a location
Q595971,graph database,0.0,0.70710677,database which utilizes structure of discrete mathematical graphs to store and search data
Q6027324,transfer learning,-0.81878984,0.2426264,research problem in machine learning (ML) that focuses on storing knowledge gained while solving one problem and applying it to a different but related problem
Q622825,cluster analysis,-0.55986243,0.29701224,task of grouping a set of objects in such a way that objects in the same group (called a cluster) are more similar (in some sense or another) to each other than to those in other groups (clusters)
Q635336,dependency injection,-1.068982,0.2753075,technique in software engineering
Q6368,web browser,-0.018217603,0.29460657,"software application for retrieving, presenting, and traversing information resources on the World Wide Web"
Q638,music,1.0060201,0.22795425,"art form, and cultural activity, whose medium is sound"
Q638608,software development,1.2231902,0.29996163,creation and maintaining of programs and applications
Q650462,synchronization,-0.034302033,0.2686383,"concept in computer science, referring to processes, or data"
Q6504956,data visualization,0.45377234,0.30535054,creation and study of the visual representation of data
Q65647244,distributed multimedia communications platform,-0.2159841,0.28222153,"program or computing platform for voice, video, chat and IoT communications over the Internet"
Q66221,computer data storage,0.73402506,0.29952076,storage of digital data readable by computers
Q665452,web scraping,-0.8751984,0.1751492,data scraping used for extracting data from websites
Q6673524,long short-term memory,-1.3396116,0.3121132,recurrent neural network architecture
Q67224805,text analysis,0.42549402,0.2884339,structured analysis of text and context
Q676880,text mining,0.0,0.70710677,process of analysing text to extract information from it
Q6880649,misuse detection,-0.3674244,0.28533456,an approach to detect abnormal system behavior and potential insider threats to vulnerable computer data
Q70507976,front end,0.26848277,0.54296756,presentation layer of piece of software
Q7139956,Parser combinator,-0.6557547,0.25488952,
Q7310755,relationship extraction,-0.8695049,0.21726438,type of text mining
Q741490,autonomous car,-0.27204505,0.26896548,vehicle operated with reduced human input
Q7431119,schema migration,-0.72346556,0.32630718,"the management of incremental, reversible changes and version control to relational database schemas"
Q747907,syntax highlighting,-0.57707655,0.29822603,"tool of editors for programming, scripting and markup"
Q750843,information processing,0.6315698,0.28593022,process in which input information is analysed or transformed in order to produce information as output
Q7544035,smart contract,0.20189607,0.2910879,transaction on a decentralized platform
Q7553,translation,0.0,0.70710677,communication of the meaning of a source-language text by means of an equivalent target-language text
Q758895,audio player software,-0.1357941,0.2888327,software or device which could play audio files or audio data
Q7600677,computer graphics,0.5224441,0.28536874,"pictures and graphics, possibly animated, that are generated using computers, for transforming and compositing various sources of images or data with precise definitions of style, layout, effects, sequencing and synchronization"
Q778043,electronic trading platform,0.19231762,0.33607203,software for trading financial products
Q77916592,static site generator,-1.0479406,0.2939562,software to generate static websites
Q782543,graphical user interface,0.43908548,0.20783362,user interface allowing interaction through graphical icons and visual indicators
Q788790,documentation,1.1751965,0.1742136,set of documents providing knowledge
Q7889,video game,0.36387965,0.30134085,electronic game that involves interaction with a user interface to generate visual feedback on a video device such as a TV screen or computer monitor
Q79798,machine translation,0.21107924,0.18422213,use of software for language translation
Q798332,back end,0.041474488,0.30584407,
Q79872,object-oriented programming,0.26506668,0.3074526,programming paradigm based on the concept of objects
Q80006,computer programming,0.57579094,0.29148293,the process of designing and building an executable computer program to accomplish a specific computing result or to perform a specific task
Q806718,banking industry,0.7364652,0.27996585,industry for financial institutions such as banks and credit unions
Q8087,geometry,0.99938416,0.30966985,branch of mathematics regarding geometric figures and properties of space
Q80993,software engineering,0.95262486,0.29207578,application of systematic approaches to developing software
Q812530,Naive Bayes classifier,-1.4808489,0.29189175,classification algorithm
Q812535,Bayesian inference,-0.8950575,0.30758956,method of statistical inference in which Bayes' theorem is used to update the probability for a hypothesis as more evidence or information becomes available
Q816747,benchmark,0.2364465,0.29334328,test to the measure performance of a computer system
Q816826,information retrieval,0.6611369,0.3012338,activity of obtaining information resources relevant to an information need from a collection of information resources
Q82571,linear algebra,0.53355527,0.29254314,branch of mathematics that studies vector spaces
Q82604,design,1.3182278,0.25303137,creation of a plan or convention for the construction of an object or a system; process of creation; act of creativity and innovation
Q830687,reinforcement learning,-0.7763713,0.1760296,field of machine learning
Q835922,lexical analysis,0.07842173,0.2334339,computing process of parsing a sequence of characters into a sequence of tokens
Q8366,algorithm,0.8034714,0.3135416,unambiguous specification of how to solve a class of problems
Q8434,education,0.0,0.70710677,learning in which knowledge and skills are transferred through teaching
Q844240,computer vision,0.5685908,0.3012638,computerized information extraction from images
Q845566,debugging,0.06746147,0.31692955,process of finding and resolving defects or problems within a computer program
Q846636,software architecture,0.46061006,0.30048645,high level structures of a software system
Q846780,Kalman filter,-1.9805644,0.29304472,algorithm
Q848436,home automation,0.21700114,0.2732609,building automation for a home
Q8513,database,0.5116983,0.32478437,organized collection of data in computing
Q858810,big data,0.7598625,0.14077385,"Information assets characterized by such a high volume, velocity, and variety to require specific technology and analytical methods for its transformation into value"
Q859938,WebSocket,-1.9845206,0.29759607,computer network protocol
Q860755,Image analysis,0.20233832,0.2923302,extraction of information from images via digital image processing techniques
Q870780,chatbot,-0.99264914,0.2902123,program or set of instructions that simulates conversation with humans
Q8789,cryptography,0.40502065,0.3094813,practice and study of techniques for secure communication in the presence of third parties
Q891055,package management system,-1.0500273,0.21239841,"software that manages the installation, upgrading, removal and dependency resolution of software packages"
Q907375,unit testing,0.074314475,0.30859658,software testing method by which individual units of source code are validated
Q9135,operating system,0.38311777,0.31020412,software that manages computer hardware resources
Q9158,email,0.59834117,0.29873508,method of electronically exchanging digital messages between people over a network
Q931309,medical imaging,-0.42202276,0.28276712,technique and process of creating visual representations of the interior of a body
Q94702,collaborative filtering,-0.77559686,0.2404137,algorithm
Q96468792,topic modeling,0.24979186,0.17903863,set of techniques in computational linguistics and related fields
Q965769,continuous integration,0.33151916,0.31068256,software development practice based on frequent submission of granular changes
Q9662,kernel,0.0,0.70710677,main component of most computer operating systems
Q98069877,video,0.95626277,0.11271982,motion picture format
Q98526763,image classification,-0.17244306,0.2686566,set of methods to group images
Q989016,distributed database,0.21302697,0.28857154,A database in which data is stored across different physical locations.
Q989632,network security,0.66778123,0.30941015,"policies and practices adopted to prevent and monitor unauthorized access, misuse, modification, or denial of computer networks and network-accessible resources"
