Wikidata ID,Frequency,GitHub Topic,Wikidata Title,Wikidata Description,Wikidata Aliases
Q965769,608,"['continuous-integration', 'ci']",continuous integration,software development practice based on frequent submission of granular changes,"['CI', 'continuous integration']"
Q9662,245,['kernel'],kernel,main component of most computer operating systems,"['operating system kernel', 'OS kernel', 'kernel']"
Q98069877,784,['video'],video,motion picture format,['video']
Q98526763,220,['image-classification'],image classification,set of methods to group images,['image classification']
Q989016,45,['distributed-database'],distributed database,A database in which data is stored across different physical locations.,['distributed database']
Q989632,49,['network-security'],network security,"policies and practices adopted to prevent and monitor unauthorized access, misuse, modification, or denial of computer networks and network-accessible resources","['netsec', 'computer network security', 'network security']"
