Wikidata ID,Frequency,GitHub Topic,Wikidata Title,Wikidata Description,Wikidata Aliases
Q2542347,50,['rna-seq'],RNA sequencing,"process of cloning, physical mapping, subcloning, sequencing, and information analysis of an RNA sequence","['RNAseq', 'RNA Sequence Analysis', 'Sequence Analysis, RNA', 'RNA sequencing']"
Q2664563,55,['q-learning'],Q-learning,Model free Reinforcement Learning algorithm. (Machine Learning algorithm),['Q-learning']
Q269608,314,['reverse-engineering'],Reverse engineering,"process by which a man-made object is deconstructed to reveal its designs, architecture, code or to extract knowledge from the object; similar to scientific research, the only difference being that scientific research is about a natural phenomenon",['Reverse engineering']
Q270471,85,['virtualization'],virtualization,computing technique for setting up virtual versions of operating systems or computer resources,"['virtualisation', 'virtualization']"
Q2715623,195,['social-network'],social network,theoretical concept in sociology,"['social networking', 'social network']"
Q2719318,74,['audio-processing'],audio signal processing,electronic manipulation of audio signals,"['audio processing', 'Acoustic signal processing', 'audio signal processing']"
Q2738570,680,['mobile'],mobile computing,use of portable computers,['mobile computing']
Q28038508,117,['image-recognition'],image recognition,image identification made by artificial intelligence,['image recognition']
Q28061130,269,['static-analysis'],static program analysis tool,programming tool for static analysis,"['source code analyzer', 'static program analyzer', 'source code analyzer tool', 'source code analysis tool', 'static analyzer', 'static program analysis tool']"
Q282453,79,['svm'],support vector machine,set of methods for supervised statistical learning,"['SVM', 'support vector machines', 'support vector machine']"
Q28374376,48,['hyperparameter-optimization'],hyperparameter optimization,choosing a set of optimal hyperparameters,"['hyperparameter tuning', 'hyperparameter optimization']"
Q28957018,283,['home-assistant'],Home Assistant,home automation software,"['Hass.io', 'Home Assistant']"
Q29649691,574,['logging'],logging,automatic creation of a log of a software process,['logging']
Q2979024,225,['http-client'],HTTP client,software category,"['Hypertext Transfer Protocol clients', 'HTTP client']"
Q2988038,98,['mobile-development'],mobile application development,process to build apps for various mobile operating systems,"['mobile app development', 'smartphone application development', 'smartphone app development', 'app development software', 'mobile application development']"
Q3025536,645,['devops'],DevOps,software development method,['DevOps']
Q3045304,382,['object-detection'],object detection,computer technology related to computer vision and image processing,['object detection']
Q30503704,132,['graph-algorithms'],graph algorithm,type of algorithm,"['algorithm in graph theory', 'graph algorithm']"
Q30642,2243,"['nlp', 'natural-language-processing', 'nlp-machine-learning']",natural language processing,field of computer science and linguistics,"['NLP', 'natural language processing']"
Q3125508,113,['hacking-tool'],hacking tool,software or program used for computer hacking,"['hacktool', 'hacking tool']"
Q3293547,51,['data-binding'],data binding,data management technique,['data binding']
Q33002955,61,['knowledge-graph'],knowledge graph,information repository structured as a graph,['knowledge graph']
Q333,85,['astronomy'],astronomy,natural science that deals with the study of celestial objects,['astronomy']
Q334384,72,['supervised-learning'],supervised learning,machine learning task of learning a function that maps an input to an output based on example input-output pairs,"['supervised machine learning', 'supervised learning']"
Q335632,74,['quantitative-finance'],mathematical finance,"field of applied mathematics, concerned with mathematical modeling of financial markets","['financial mathematics', 'quantitative finance', 'Quantitative trading', 'quantitative trading', 'mathematical finance']"
Q336,165,['science'],science,systematic enterprise that builds and organizes knowledge,['science']
Q33742,59,['nlu'],natural language,"language naturally spoken by humans, as opposed to ""constructed"" and ""formal"" languages","['ordinary language', 'natural language']"
Q35127,433,['website'],website,set of related web pages served from a single web domain,"['World Wide Web site', 'web site', 'site', 'WWW site', 'Internet site', 'website']"
Q3536669,88,['video-processing'],video processing,,['video processing']
Q355134,46,['graphics-engine'],graphics engine,,"['3D engine', 'graphics engine']"
Q3560506,66,['anomaly-detection'],anomaly detection,"the identification of rare items, events or observations which raise suspicions by differing significantly from the expected or majority of the data","['outlier detection', 'novelty detection', 'anomaly detection']"
Q3621696,72,['language-model'],language model,statistical model of structure of language,['language model']
Q373442,50,['rendering-engine'],web browser engine,software used to process and render a web page,"['layout engine', 'web layout engine', 'web rendering engine', 'rendering engine', 'web content renderer', 'browser engine', 'web browser engine']"
Q386275,152,['web-development'],web development,built highly interactive and responsive website using cutting edge web technologies,"['webdev', 'web development']"
Q39161486,48,['image-captioning'],image captioning,,['image captioning']
Q395,411,"['math', 'mathematics']",mathematics,science of abstract objects and structures,"['math', 'maths', 'mathematics']"
Q3958022,977,['serverless'],serverless computing,cloud computing model,"['serverless', 'function as a service', 'FaaS', 'serverless computing']"
Q3962217,276,['distributed-systems'],distributed system,,"['distributed systems', 'distributed system']"
Q3988,527,"['real-time', 'realtime']",real-time computing,"study of hardware and software systems that have a ""real-time constraint""","['reactive computing', 'real-time system', 'realtime computing', 'realtime system', 'real-time computing']"
Q403574,100,['named-entity-recognition'],named-entity recognition,extraction of named entity mentions in unstructured text into pre-defined categories,"['named entity extraction', 'entity extraction', 'entity identification', 'entity recognition', 'NER', 'entity chunking', 'named entity recognition and classification', 'NERC', 'named-entity recognition']"
Q412438,47,['image-compression'],image compression,reduction of image size to save storage and transmission costs,['image compression']
Q413,178,['physics'],physics,"study of matter and its motion, along with related concepts such as energy and force","['physical', 'physic', 'Physics', 'physics']"
Q42283,51,['tcp-server'],File Transfer Protocol,standard protocol for transferring files over TCP/IP networks,"['FTP', 'File Transfer Protocol']"
Q43015,254,['finance'],finance,"academic discipline studying businesses, financing, investments and protection of economic value","['Finance', 'finance']"
Q4343952,469,['dashboard'],business dashboard,aggregate business progress report,"['dashboard', 'business dashboard']"
Q4354073,179,['reactive-programming'],reactive programming,programming paradigm focused on data flow and change propragation,['reactive programming']
Q43967068,59,['automl'],automated machine learning,process of automating the end-to-end process of machine learning,"['AutoML', 'automatic machine learning', 'automated machine learning']"
Q440296,74,['super-resolution'],image scaling,changing the resolution of a digital image,"['upscaling', 'downscaling', 'resolution enhancement', 'superresolution', 'super-resolution', 'image super-resolution', 'image interpolation', 'image resizing', 'image scaling']"
Q44127,782,['server'],server,computer program or device that provides access to a central resource or other functionality for clients,"['service', 'server process', 'server job', 'application server', 'server-side', 'server']"
Q4417999,107,['network-analysis'],network analysis,use of graph theory to solve network problems,"['analysis of networks', 'graph analysis', 'network analysis']"
Q45045,272,['simulation'],simulation,"imitation of the operation of a real-world process or system over time, for studying either real events in many contexts or effects of alternative conditions and courses of actions",['simulation']
Q451553,961,"['visualization', 'visualisation']",visualization,"set of techniques for creating images, diagrams, or animations to communicate a message","['visualisation', 'Imaging', 'visualization']"
Q45211,52,['content-management-system'],Web content management system,a software content management system (CMS) specifically for web content.,"['Web CMS, WCMS, WCM', 'Web content management system']"
Q4544684,446,['search'],search,"set of methods, means, initiatives, organizational tools, aimed at finding people or things","['research', 'search']"
Q45842,337,['crawler'],web crawler,"internet bot that systematically browses the World Wide Web, typically for the purpose of Web indexing (web spidering)","['ant', 'automatic indexer', 'spider (web)', 'web spider', 'web scutter', 'web crawler']"
Q4636322,85,['pose-estimation'],3D pose estimation,process of determining spatial characteristics of objects,['3D pose estimation']
Q466,1142,['web'],World Wide Web,system of interlinked hypertext documents accessed via the Internet,"['WWW', 'W3', 'the Web', 'Web', 'web', 'the World Wide Web', 'The Web', 'World Wide Web']"
Q4677630,61,['action-recognition'],activity recognition,filed of research related to recognizing the actions and goals of computer agents,['activity recognition']
Q47146,1333,"['ui', 'user-interface']",user interface,means by which a user interacts with and controls a machine,"['UI', 'input method', 'user interface']"
Q475000,101,['stock-market'],stock market,public entity for the trading of company stocks and shares,"['equity market', 'share market', 'Stock Market', 'Mutual funds', 'stock markets', 'stock market']"
Q47506,643,['compiler'],compiler,computer program that transforms source code into object code,"['code compiler', 'Compiler', 'compiler']"
Q478798,740,"['image', 'images']",image,artifact that depicts or records visual perception,"['picture', 'graphic', 'images', 'Imake', 'image']"
Q4800952,46,['human-pose-estimation'],Articulated body pose estimation,,['Articulated body pose estimation']
Q483130,216,['gis'],geographic information system,spatial data information systems,"['GIS', 'geographic information systems', 'geographical information system', 'geographic information system']"
Q483639,65,['cloud-computing'],cloud computing,"form of Internet-based computing, whereby shared resources, software and information are provided to computers and other devices","['cloud platform', 'cloud', 'cloud computing']"
Q484847,373,"['ecommerce', 'e-commerce']",e-commerce,type of business industry usually conducted over the internet,"['eCommerce', 'electronic commerce', 'E-Commerce', 'online commerce', 'Internet commerce', 'e-business', 'e-commerce']"
Q485396,372,['analytics'],analytics,"discovery, interpretation, and communication of meaningful patterns in data","['data analytics', 'analytics']"
Q4868296,309,['font'],font,"particular size, weight and style of a typeface",['font']
Q494756,454,['data'],data,"quantities, characters, or symbols on which operations are performed by a computer","['computer data', 'digital data', 'data']"
Q507703,44,['irc-bot'],IRC bot,set of scripts or an independent program that connects to Internet Relay Chat as a client,"['Internet Relay Chat bot', 'IRC bot']"
Q51289900,638,['deep-neural-networks'],deep neural network,artificial neural network,"['deep artificial neural network', 'DNN', 'deep network', 'deep neural network']"
Q52720701,195,['static-site'],static website,,['static website']
Q5276156,139,['cybersecurity'],digital security,various ways of protecting computer's internet account and files from intrusion by an outside user,"['cybersecurity', 'digital security']"
Q528166,555,['client'],client,piece of computer hardware or software accessings a server service,"['client-side', 'client software', 'client']"
Q5318,376,['router'],router,"device that forwards data packets between computer networks, creating an overlay internetwork","['routers', 'router']"
Q5337692,45,['edge-computing'],edge computing,distributed computing,['edge computing']
Q545981,92,['image-manipulation'],image editing,"processes of altering images, digital or traditional photos and add/paste/and cut words","['photo editing', 'image editing']"
Q54837,54,['semantic-web'],Semantic Web,extension of the Web to facilitate data exchange,"['Sem Web', 'SemWeb', 'Semantic Web']"
Q55080229,262,['deep-reinforcement-learning'],deep reinforcement learning,,['deep reinforcement learning']
Q5532625,87,['generative-model'],generative model,,['generative model']
Q554950,185,"['recommender-system', 'recommendation-system']",recommender system,information filtering system to predict users' preferences,"['recommendation system', 'recommendation engine', 'recsys', 'recommender system']"
Q55624999,78,['dnn'],neural network,structure in biology and artificial intelligence,['neural network']
Q568742,539,['3d'],3D modeling,process of developing a mathematical representation of any three-dimensional surface of object via specialized software,['3D modeling']
Q56933,569,"['segmentation', 'semantic-segmentation', 'image-segmentation']",image segmentation,Division of an image into sets of pixels for further processing,"['sementation', 'image segmentation']"
Q57261400,115,['continuous-deployment'],continuous deployment,software engineering approach in which software functionalities are delivered frequently,"['CD', 'continuous deployment']"
Q58199,382,"['messaging', 'chat-application', 'instant-messaging']",instant messaging,form of communication over the Internet,"['IM', 'chat', 'text chat', 'messaging', 'instant messaging']"
Q58748,412,['orm'],object–relational mapping,programming technique,"['ORM', 'object-relational mapping', 'Object Relational Mapper', 'O/RM', 'O/R mapping tool', 'object–relational mapping']"
Q5915793,148,['geospatial'],geographic information,data and information having an implicit or explicit association with a location,['geographic information']
Q595971,71,['graph-database'],graph database,database which utilizes structure of discrete mathematical graphs to store and search data,['graph database']
Q6027324,150,['transfer-learning'],transfer learning,research problem in machine learning (ML) that focuses on storing knowledge gained while solving one problem and applying it to a different but related problem,"['inductive transfer', 'transfer learning']"
Q61087512,55,['ecommerce-platform'],eCommfy,SaaS based enterprise eCommerce platform,['eCommfy']
Q622825,250,['clustering'],cluster analysis,task of grouping a set of objects in such a way that objects in the same group (called a cluster) are more similar (in some sense or another) to each other than to those in other groups (clusters),"['clustering', 'cluster analysis in marketing', 'cluster analysis']"
Q635336,329,['dependency-injection'],dependency injection,technique in software engineering,"['DI', 'dependency injection']"
Q6368,539,['browser'],web browser,"software application for retrieving, presenting, and traversing information resources on the World Wide Web","['WWW browser', 'Web client', 'WWW client', 'W3 browser', 'W3 client', 'browser', 'Web browser', 'Internet browser', 'internet browser', 'W browser', 'web browser']"
Q638,645,['music'],music,"art form, and cultural activity, whose medium is sound",['music']
Q638608,224,['development'],software development,creation and maintaining of programs and applications,['software development']
Q650462,97,['synchronization'],synchronization,"concept in computer science, referring to processes, or data",['synchronization']
Q6504956,563,['data-visualization'],data visualization,creation and study of the visual representation of data,"['dataviz', 'data visualisation', 'data viz', 'datavis', 'data visualization']"
Q65647244,52,['iot-platform'],distributed multimedia communications platform,"program or computing platform for voice, video, chat and IoT communications over the Internet","['softphone', 'distributed multimedia communications platform']"
Q66221,320,['storage'],computer data storage,Storage of digital data readable by computers,"['storage', 'memory', 'data storage', 'computer storage', 'computer data storage']"
Q665452,554,"['scraper', 'scraping', 'web-scraping', 'webscraping']",web scraping,data scraping used for extracting data from websites,"['web harvesting', 'web data extraction', 'Web scraping', 'web scraping']"
Q6673524,393,['lstm'],long short-term memory,recurrent neural network architecture,"['LSTM', 'long short-term memory']"
Q67224805,55,['text-analysis'],text analysis,structured analysis of text and context,['text analysis']
Q676880,121,['text-mining'],text mining,process of analysing text to extract information from it,"['text data mining', 'textmining', 'text-mining', 'text mining']"
Q6880649,55,['vulnerability-detection'],misuse detection,an approach to detect abnormal system behavior and potential insider threats to vulnerable computer data,['misuse detection']
Q70507976,653,['frontend'],front end,presentation layer of piece of software,"['frontend', 'front-end', 'front end']"
Q7139956,49,['parser-combinators'],Parser combinator,,['Parser combinator']
Q7310755,44,['relation-extraction'],relationship extraction,type of text mining,"['relation extraction', 'relationship extraction']"
Q741490,68,['autonomous-vehicles'],autonomous car,vehicle operated with reduced human input,"['driverless car', 'self-driving car', 'robotic car', 'selfdriving car', 'cars that drive themselves', 'car that drives itself', 'autonomous car']"
Q7431119,46,['database-migrations'],schema migration,"the management of incremental, reversible changes and version control to relational database schemas","['database migration', 'database change management', 'schema migration']"
Q747907,228,['syntax-highlighting'],syntax highlighting,"tool of editors for programming, scripting and markup",['syntax highlighting']
Q750843,53,['data-processing'],information processing,process in which input information is analysed or transformed in order to produce information as output,"['data processing', 'information process', 'information processing']"
Q7544035,320,['smart-contracts'],smart contract,transaction on a decentralized platform,['smart contract']
Q7553,315,['translation'],translation,communication of the meaning of a source-language text by means of an equivalent target-language text,"['translating', 'translate', 'translation']"
Q758895,93,['audio-player'],audio player software,software or device which could play audio files or audio data,"['audio player', 'music player', 'audio player software']"
Q7600677,508,['graphics'],computer graphics,"pictures and graphics, possibly animated, that are generated using computers, for transforming and compositing various sources of images or data with precise definitions of style, layout, effects, sequencing and synchronization","['CG', 'computer graphics']"
Q778043,49,['trading-platform'],electronic trading platform,software for trading financial products,"['online trading platform', 'electronic trading system', 'electronic exchange', 'electronic trading platform']"
Q77916592,278,['static-site-generator'],static site generator,software to generate static websites,"['static website generator', 'static site generator']"
Q782543,647,['gui'],graphical user interface,user interface allowing interaction through graphical icons and visual indicators,"['GUI', 'graphical user interface']"
Q788790,684,['documentation'],documentation,set of documents providing knowledge,['documentation']
Q7889,1418,['game'],video game,electronic game that involves interaction with a user interface to generate visual feedback on a video device such as a TV screen or computer monitor,"['video games', 'videogame', 'videogames', 'game', 'vg', 'vidya', 'video game']"
Q79798,60,['machine-translation'],machine translation,use of software for language translation,"['MT', 'Machine Translation', 'machine translation']"
Q798332,268,['backend'],back end,,['back end']
Q79872,62,['object-oriented'],object-oriented programming,programming paradigm based on the concept of objects,"['OOP', 'Object-oriented programming', 'Object-Oriented Programming', 'object-oriented programming']"
Q80006,168,['programming'],computer programming,occupational field,"['programming', 'computer programming']"
Q806718,47,['banking'],banking industry,industry for financial institutions such as banks and credit unions,"['economics of banking', 'banking', 'bank industry', 'banking sector', 'banking industry']"
Q8087,136,['geometry'],geometry,branch of mathematics regarding geometric figures and properties of space,['geometry']
Q80993,46,['software-engineering'],software engineering,application of systematic approaches to developing software,"['SE', 'software engineering']"
Q812530,49,['naive-bayes-classifier'],Naive Bayes classifier,classification algorithm,"['Naive Bayes', 'Naive Bayes classifier']"
Q812535,90,['bayesian-inference'],Bayesian inference,method of statistical inference in which Bayes' theorem is used to update the probability for a hypothesis as more evidence or information becomes available,"['Bayesian analysis', ""Bayes' solution"", 'Bayesian approach', 'Bayesian method', 'Bayesian inference']"
Q816747,265,['benchmark'],benchmark,test to the measure performance of a computer system,"['software benchmark', 'computer benchmark', 'hardware benchmark', 'performance benchmark', 'performance test', 'benchmark']"
Q816826,78,['information-retrieval'],information retrieval,activity of obtaining information resources relevant to an information need from a collection of information resources,"['IR', 'information storage and retrieval', 'info retrieval', 'information retrieval']"
Q82571,138,['linear-algebra'],linear algebra,branch of mathematics that studies vector spaces,['linear algebra']
Q82604,410,['design'],design,creation of a plan or convention for the construction of an object or a system; process of creation; act of creativity and innovation,"['styling', 'design']"
Q830687,667,['reinforcement-learning'],reinforcement learning,field of machine learning,['reinforcement learning']
Q835922,68,['lexer'],lexical analysis,computing process of parsing a sequence of characters into a sequence of tokens,"['lexing', 'tokenization', 'lexical analysis']"
Q8366,1200,"['algorithm', 'algorithms']",algorithm,unambiguous specification of how to solve a class of problems,"['mathematical algorithm', 'algorithms', 'algorithm']"
Q8434,285,['education'],education,learning in which knowledge and skills are transferred through teaching,"['educate', 'education']"
Q844240,1673,"['computer-vision', 'cv']",computer vision,computerized information extraction from images,['computer vision']
Q845566,373,"['debug', 'debugging']",debugging,process of finding and resolving defects or problems within a computer program,"['debug', 'debugging']"
Q846636,366,['architecture'],software architecture,high level structures of a software system,['software architecture']
Q846780,53,['kalman-filter'],Kalman filter,algorithm,"['linear quadratic estimation', 'LQE', 'Kalman filter']"
Q848436,275,['home-automation'],home automation,building automation for a home,"['smart home', 'domotics', 'smart house', 'home automation']"
Q8513,1735,['database'],database,organized collection of data in computing,"['db', 'DB', 'database, DB', 'database']"
Q858810,326,"['big-data', 'bigdata']",big data,"Information assets characterized by such a high volume, velocity, and variety to require specific technology and analytical methods for its transformation into value",['big data']
Q859938,434,['websockets'],WebSocket,computer network protocol,['WebSocket']
Q860755,68,['image-analysis'],Image analysis,extraction of information from images via digital image processing techniques,['Image analysis']
Q870780,479,['chatbot'],chatbot,program or set of instructions that simulates conversation with humans,"['IM bot', 'AI chatbot', 'chat bot', 'chatter bot', 'chat-bot', 'bot', 'chatterbot', 'Conversational UI', 'chatbot']"
Q8789,913,"['cryptography', 'crypto']",cryptography,practice and study of techniques for secure communication in the presence of third parties,"['cryptographic engineering', 'cryptography']"
Q891055,255,"['package-manager', 'package-management']",package management system,"software that manages the installation, upgrading, removal and dependency resolution of software packages","['package manager', 'application manager', 'software package management system', 'package management system']"
Q907375,403,"['unit-testing', 'unittest', 'unit-test']",unit testing,software testing method by which individual units of source code are validated,['unit testing']
Q9135,181,['operating-system'],operating system,software that manages computer hardware resources,"['OS', 'Operating System', 'operating system']"
Q9158,546,"['email', 'mail']",email,method of electronically exchanging digital messages between people over a network,"['electronic mail', 'e-mail', '📧', 'email']"
Q931309,130,['medical-imaging'],medical imaging,technique and process of creating visual representations of the interior of a body,"['scanning', 'diagnostic imaging', 'medical imaging']"
Q94702,66,['collaborative-filtering'],collaborative filtering,algorithm,['collaborative filtering']
Q96468792,49,['topic-modeling'],topic modeling,set of techniques in computational linguistics and related fields,"['topic modeling', 'topic modeling']"
